Power	Flavor Text	Power Set	Prerequisites	Action	Trigger	Duration	Range	Cost	Effect	Rank Can Learn
Spin & Throw	The character throws a grabbed foe to the ground.	Martial Arts	Grappling Technique, Rank 2	Reaction	An enemy the character can pick up is grabbed.	Instant	None	5	The character makes a Melee attack against the grabbed foe. If the attack is a success, the enemy takes regular damage and is knocked prone. On a Fantastic success, the enemy takes double damage and is knocked prone, pinned and stunned for one round. Either way, the character can move the enemy to any open space within reach.	2
Stopping Power	The character keeps shooting at the target.	Ranged weapons	Double Tap, Rank 2	Standard	None	Instant	None	5	The character makes a ranged attack on an enemy. If the attack is a success, the enemy takes regular damage. On a Fantastic success, the enemy takes double damage, and the character can make another regular ranged attack on the same target.	2
Sturdy 1	The character has protection from physical damage.	None	None	None	None	Permanent	None	0	The character's body is so sturdy that they have Health Damage Reduction 1. If this power stems from armor or anything else removable—like Iron Man’s armor—the character should apply the Tech Reliance trait to it.	1
Sturdy 2	The character is protected as if by steel.	None	Sturdy 1, Rank 2	None	None	Permanent	None	0	The character gains Health Damage Reduction 2.	2
Suppressive Fire	The character forces their foes to keep their heads down.	Ranged weapons	None	Standard	None	Instant	None	0	The character makes an Agility attack against a target's Vigilance defense. If the attack is a success, apply Health Damage Reduction normally. Any damage taken is then applied to the target's Focus instead. If it’s a Fantastic success, the damage is doubled, and if the target takes any Focus damage, they are stunned for one round.	1
Uncanny 1	The character has protection against mental assaults.	None	None	None	None	Permanent	None	0	Any damage multiplier for attacks against the character's Focus is reduced by 1. If this power is part of a battle suit, the power is integrated into a removable helmet. Otherwise, it’s a part of the character. If this power stems from armor or anything else removable—like Magneto's helmet—the character should apply the Tech Reliance trait to it.	1
Uncanny 2	The character's mind is protected as if by steel.	None	Uncanny 1, Rank 2	None	None	Permanent	None	0	Any damage multiplier for attacks against the character's Focus is reduced by 2.	2
Unflappable Poise	The character can dodge most close attacks.	Martial Arts	Defense Stance, Rank 3	None	None	Permanent	None	0	Any close attacks against the character have trouble. While they use Defense Stance, such attacks have double trouble.	3
Unstoppable Assault	The character hews a path through their foes.	Melee Weapons	Furious Attacks, Focused Fury, Rank 4	Standard	None	Instant	None	15	The character makes a Melee check and compares that against the Melee defense of every enemy within their reach. Any enemy the attack succeeds against takes half regular damage. On a Fantastic success, those enemies take full regular damage instead and suffer the weapon's special effect. The character may then pay 15 more Focus to do the same thing again—before which they can move up to half their Speed with whatever is left from their normal movement action. They can keep doing this until they run out of Speed or Focus. Each target can only be affected by this attack by this character once per round.	4
Unstoppable Position	The character's enemies struggle to gang up on them.	Martial Arts	Counterstrike Technique, Rank 3	None	None	Permanent	None	0	If the character is attacked, all other close attacks against them have trouble until the start of their next turn.	3
Vicious Attack	The character strikes a felling blow.	Melee Weapons	None	Standard	None	Instant	None	0	The character makes a close attack. If the attack is a success, the enemy takes regular damage. On a Fantastic success, the enemy takes double damage and suffers the weapon's special effect.	1
Weapons Blazing	The character blazes two foes at once	Ranged weapons	Snap Shooting	Standard	None	Instant	None	0	The character splits their attack to make two ranged attacks against separate targets (or they can focus a single attack on a single target) Make a single Agility check and compare it to the targets’ Agility defenses. On a success, the affected target takes half regular damage. On a Fantastic success, the affected target takes full damage, and the character can make a bonus attack with this power against any availity target with the same effect	1
Whirling Frenzy	The character assaults a foe with a tornado of whirling attacks	Melee Weapons	Fast Attacks, Rank 2	Standard	None	Instant	None	5	The character makes an Agility check and compares against the Agility defense of every enemy within reach. If an attack is a success, the enemy takes half regular damage. On a FAntastic success the enemy takes full damage and suffers a weapon's special effect.	2
Wisdom	The character not only has brains, but knows how to use them.	None	None	None	None	Permanent	None	0	The character can use their Ego defense score against Logic attacks too.	1
Wisecracker	The character irritates the foe with sharp wit.	None	None	Reaction	The character succeeds an attack against an enemy in earshot, or an enemy within earshot fails an attack on them.	Instant	None	0	The character cracks a joke at the enemy's expense. Make an Ego attack. On a success do regular focus damage. On a Fantastic Success the damage is doubled and the target is stunned for one round.	1